{
  "$schema": "https://json-schema.org/draft/2020-12/schema",
  "$id": "https://personalclaw.dev/schemas/personalclaw.sources.schema.json",
  "title": "PersonalClaw website source manifest",
  "type": "object",
  "additionalProperties": false,
  "required": [
    "$schema",
    "schemaVersion",
    "channel",
    "sources",
    "data"
  ],
  "properties": {
    "$schema": {
      "const": "./personalclaw.sources.schema.json"
    },
    "schemaVersion": {
      "const": 1
    },
    "channel": {
      "enum": [
        "pre-release",
        "released"
      ]
    },
    "sources": {
      "type": "object",
      "additionalProperties": false,
      "required": [
        "core",
        "apps"
      ],
      "properties": {
        "core": {
          "$ref": "#/$defs/coreSource"
        },
        "apps": {
          "$ref": "#/$defs/appsSource"
        }
      }
    },
    "data": {
      "description": "Data this site renders that is published continuously rather than released: pinned by commit, never by tag, so it takes no part in release parity.",
      "type": "object",
      "additionalProperties": false,
      "required": [
        "registry"
      ],
      "properties": {
        "registry": {
          "$ref": "#/$defs/registrySource"
        }
      }
    }
  },
  "allOf": [
    {
      "if": {
        "properties": {
          "channel": {
            "const": "pre-release"
          }
        },
        "required": [
          "channel"
        ]
      },
      "then": {
        "properties": {
          "sources": {
            "type": "object",
            "properties": {
              "core": {
                "type": "object",
                "properties": {
                  "tag": {
                    "const": null
                  }
                }
              },
              "apps": {
                "type": "object",
                "properties": {
                  "tag": {
                    "const": null
                  }
                }
              }
            }
          }
        }
      }
    },
    {
      "if": {
        "properties": {
          "channel": {
            "const": "released"
          }
        },
        "required": [
          "channel"
        ]
      },
      "then": {
        "properties": {
          "sources": {
            "type": "object",
            "properties": {
              "core": {
                "type": "object",
                "properties": {
                  "tag": {
                    "$ref": "#/$defs/tag"
                  }
                }
              },
              "apps": {
                "type": "object",
                "properties": {
                  "tag": {
                    "$ref": "#/$defs/tag"
                  }
                }
              }
            }
          }
        }
      }
    }
  ],
  "$defs": {
    "commit": {
      "type": "string",
      "pattern": "^[0-9a-f]{40}$"
    },
    "tag": {
      "type": "string",
      "pattern": "^v[0-9]+\\.[0-9]+\\.[0-9]+(?:[-+][0-9A-Za-z.-]+)?$"
    },
    "source": {
      "type": "object",
      "additionalProperties": false,
      "required": [
        "repository",
        "commit",
        "tag"
      ],
      "properties": {
        "repository": {
          "type": "string"
        },
        "commit": {
          "$ref": "#/$defs/commit"
        },
        "tag": {
          "oneOf": [
            {
              "$ref": "#/$defs/tag"
            },
            {
              "type": "null"
            }
          ]
        }
      }
    },
    "coreSource": {
      "description": "Core is also the source of the installer this site serves at /install. `npm run sync:sources` writes public/install from the pinned commit's deploy/website/install.sh and records the commit it read and the file's sha256, so a hand edit or a pin moved without a sync fails offline. On the released channel it also records the release's assets (`npm run record:release`): each one's name, size and SHA-256 as GitHub's release record holds them, which /release shows and scripts/validate-release-parity.mjs compares with the live release.",
      "type": "object",
      "additionalProperties": false,
      "required": [
        "repository",
        "commit",
        "tag",
        "installSha256",
        "installCommit"
      ],
      "properties": {
        "repository": {
          "const": "PersonalClaw/PersonalClaw"
        },
        "commit": {
          "$ref": "#/$defs/commit"
        },
        "tag": {
          "oneOf": [
            {
              "$ref": "#/$defs/tag"
            },
            {
              "type": "null"
            }
          ]
        },
        "installSha256": {
          "$ref": "#/$defs/sha256"
        },
        "installCommit": {
          "$ref": "#/$defs/commit"
        },
        "releaseAssets": {
          "type": "array",
          "minItems": 1,
          "items": {
            "type": "object",
            "additionalProperties": false,
            "required": [
              "name",
              "size",
              "sha256"
            ],
            "properties": {
              "name": {
                "type": "string",
                "minLength": 1
              },
              "size": {
                "type": "integer",
                "minimum": 1
              },
              "sha256": {
                "$ref": "#/$defs/sha256"
              }
            }
          }
        }
      }
    },
    "appsSource": {
      "allOf": [
        {
          "$ref": "#/$defs/source"
        },
        {
          "type": "object",
          "properties": {
            "repository": {
              "const": "PersonalClaw/PersonalClawApps"
            }
          }
        }
      ]
    },
    "registrySource": {
      "type": "object",
      "additionalProperties": false,
      "required": [
        "repository",
        "commit"
      ],
      "properties": {
        "repository": {
          "const": "PersonalClaw/registry"
        },
        "commit": {
          "$ref": "#/$defs/commit"
        }
      }
    },
    "sha256": {
      "type": "string",
      "pattern": "^[0-9a-f]{64}$"
    }
  }
}
