{
  "$schema": "./personalclaw.sources.schema.json",
  "schemaVersion": 1,
  "channel": "released",
  "sources": {
    "core": {
      "repository": "PersonalClaw/PersonalClaw",
      "commit": "c705b30264b9f87db6b91429e25a2bc5ee939464",
      "tag": "v0.2.3",
      "installSha256": "f46f3a3bef4f218dfc3679f63e3e891336d2c10ac6f4a4286307f98c55e1bd91",
      "installCommit": "c705b30264b9f87db6b91429e25a2bc5ee939464"
    },
    "apps": {
      "repository": "PersonalClaw/PersonalClawApps",
      "commit": "467cda1ae36d00a45e49418a493401fd7e3905d4",
      "tag": "v0.2.2"
    }
  },
  "data": {
    "registry": {
      "repository": "PersonalClaw/registry",
      "commit": "53c1bcd13757311fe6060f7c71ca1f73f1c9fa90"
    }
  }
}
